Puxada frontal na polia alta;Latíssimo do dorso, trapézio, bíceps braquial, deltoides posterior;004
Remada curvada com barra;Latíssimo do dorso, trapézio, romboides, bíceps braquial;005
Desenvolvimento militar;Deltoides, trapézio, tríceps braquial;006
Flexão de braços (push-up);Peitoral maior, deltoides anterior, tríceps braquial, músculos estabilizadores do core;007
Afundo;Quadríceps, glúteos, isquiotibiais, músculos estabilizadores do core;008
Elevação lateral com halteres;Deltoides lateral, trapézio;009
Rosca direta com barra;Bíceps braquial, braquial, braquiorradial;010

